tu_id	speaker	start	end	duration	text
1008	TO077	4194.752	4198.512	3.760	 al fatto che fosse stata rispettata
1009	TO077	4198.669	4201.795	3.126	 la lettera dello statuto albertino
1010	TO077	4202.266	4205.114	2.848	 e in fondo la prassi costituzionale
1011	TO077	4205.543	4208.138	2.595	 e cioè {P} il re
1012	TO077	4208.981	4211.923	2.942	 dà l' incarico a un personaggio
1013	TO077	4212.087	4215.416	3.329	 che lui ritiene in grado di formare un governo
1014	TO077	4216.259	4217.245	0.986	 e:
1015	TO077	4218.019	4221.368	3.349	 bisogna dire che effettivamente
1016	TO077	4221.981	4224.949	2.968	 le cose e:h andarono in questo modo
1017	TO077	4225.680	4229.870	4.190	 perché e::h mussolini ha avuto l' incarico
1018	TO077	4230.240	4232.904	2.664	 fece le sue consultazioni
1019	TO077	4233.211	4238.275	5.064	 e::h ottenne l' assenso da parte di molti liberali
1020	TO077	4238.395	4242.762	4.367	 di dei cattolici di far parte di un governo di coalizione
1021	TO077	4243.552	4244.267	0.715	 e
1022	TO077	4244.778	4248.689	3.911	 consapevole di avere la maggioranza in parlamento
1023	TO077	4249.075	4252.524	3.449	 e:h si presento' in aula e chiese
1024	TO077	4252.720	4254.924	2.204	 la fiducia {P} della camera
1025	TO077	4255.095	4256.899	1.804	 quello è poi
1026	TO077	4257.111	4263.674	6.563	 il momento clu è una delle pagine più drammatiche della storia d' italia ma che ci dice anche
1027	TO077	4265.322	4269.373	4.051	 come nascano, possano nascere le dittature
1028	TO077	4269.969	4271.982	2.013	 perché e::h
1029	TO077	4272.241	4273.601	1.360	 in questa
1030	TO077	4273.799	4275.470	1.671	 e:h seduta
1031	TO077	4275.725	4278.630	2.905	 alla camera beh fa impressione
1032	TO077	4279.223	4285.097	5.874	 rileggersi il discorso che: fece, o leggere i resoconti (che fece) >cioè<
1033	TO077	4285.829	4290.974	5.145	 mussolini arrivò lì e davanti alla camera dei deputati disse
1034	TO077	4291.056	4295.860	4.804	 potevo fare di quest' aula sorda e grigia un bivacco di manipoli
1035	TO077	4296.302	4301.525	5.223	 potevo sprangare il parlamento e costituire un governo esclusivamente di fascisti
1036	TO077	4301.586	4303.865	2.279	 cosa non vera eh ma insomma vabbè
1037	TO077	4304.710	4305.874	1.164	 potevo
1038	TO077	4306.160	4311.559	5.399	 ma non ho {P} e poi le cronache dicono che fece una sospensione di voce
1039	TO077	4311.685	4314.039	2.354	 almeno in questo primo tempo
1040	TO077	4314.500	4316.918	2.418	 voluto voluto farlo
1041	TO077	4317.445	4321.869	4.424	 e:: e la camera gli ha votato la fiducia
1042	TO077	4322.972	4326.390	3.418	 a votare contro sono stati solo i socialisti
1043	TO077	4326.687	4329.936	3.249	 e:::h i comunisti che erano molti
1044	TO077	4329.944	4333.508	3.564	 di meno e pochissimi altri esponenti.
1045	TO077	4333.969	4339.640	5.671	 i liberali che non volevano saperne non si presentarono alla camera
1046	TO077	4340.012	4342.981	2.969	 e::h e quindi voi capite
1047	TO077	4343.555	4346.365	2.810	 e:h allora, mettiamola così
1048	TO077	4346.508	4349.894	3.386	 io già ne avevo accennato in altre lezioni
1049	TO077	4352.192	4355.565	3.373	 si puo' dire che fu seguito
1050	TO077	4355.810	4359.032	3.222	 l' iter, la prassi parlamentare
1051	TO077	4359.532	4362.798	3.266	 beh se uno guarda alla forma forse sì
1052	TO077	4363.528	4369.268	5.740	 beh però a questo mondo quando valutiamo qualsiasi fenomeno dobbiamo guardare
1053	TO077	4369.358	4372.079	2.721	 forma e contenuto, dobbiamo guardare
1054	TO077	4372.282	4377.263	4.981	 i fenomeni nella loro complessità {P} e e quindi
1055	TO077	4377.490	4379.920	2.430	 la decisione del re e::h
1056	TO077	4379.956	4386.507	6.551	 (pre::) la non firma del decreto per lo stato d' assedio avvenuto
1057	TO077	4386.644	4388.304	1.660	 in un clima eh in cui
1058	TO077	4388.335	4393.967	5.632	 c' è qualche decina di migliaia di scalmanati armati che circondano la capitale
1059	TO077	4394.591	4396.107	1.516	 uno che viene lì
1060	TO077	4396.141	4401.793	5.652	 e ti dice potevo fare quello che volevo eh ma almeno in questo momento non ho voluto eh
1061	TO077	4401.954	4403.821	1.867	 e poi quelli votano
1062	TO077	4404.121	4408.899	4.778	 beh a casa mia quello non si chiama rispetto della prassi parlamentare eh
1063	TO077	4408.941	4411.036	2.095	 inutile girarci: attorno
1064	TO077	4411.667	4414.857	3.190	 però questo {P} fatto e::h
1065	TO077	4416.165	4420.355	4.190	 va tenuto ben presente perché e::h
1066	TO077	4421.203	4426.506	5.303	 è facile col senno di poi {P} dire e::h
1067	TO077	4427.821	4432.258	4.437	 quegli sciagurati gli hanno votato tutti:: la fiducia
1068	TO077	4432.651	4436.297	3.646	 bisogna anche quando qualora questa cosa
1069	TO077	4436.770	4442.156	5.386	 non ci piaccia molto {ride} il termine (individuale) a me non piace di sicuro
1070	TO077	4443.223	4444.008	0.785	 però
1071	TO077	4444.175	4447.728	3.553	 provare a a immedesimarsi nel nel
1072	TO077	4447.785	4452.095	4.310	 clima dell' epoca, nel: cioè questi
1073	TO077	4452.470	4455.033	2.563	 signori liberali
1074	TO077	4455.641	4460.059	4.418	 fedelissimi al re, fedelissimi alle istituzioni
1075	TO077	4460.843	4461.995	1.152	 e::h
1076	TO077	4462.670	4465.911	3.241	 in parte non è che non si rendesso conto
1077	TO077	4466.248	4474.038	7.790	 di: di di di quale elemento di discontinuità poneva quel~ quella formazione di un governo
1078	TO077	4474.878	4479.764	4.886	 e però che alternative::: potevano avere
1079	TO077	4480.346	4483.599	3.253	 e:h il timore della guerra civile
1080	TO077	4483.861	4487.569	3.708	 e::h del fatto che l' esercito potesse
1081	TO077	4487.608	4492.336	4.728	 dio non voglia quando l' esercio si rifiu~ in un qualsiasi paese
1082	TO077	4492.593	4495.891	3.298	 quando l' esercito si rifiuta di obbedire
1083	TO077	4496.171	4498.405	2.234	 agli ordini dell' esecutivo
1084	TO077	4498.803	4504.316	5.513	 lì potete stare per certi che lì è imminente una rivoluzione,
1085	TO077	4504.364	4506.237	1.873	 o un qualcosa del genere
1086	TO077	4507.127	4510.216	3.089	 tutti questi non dico che giustifichino
1087	TO077	4510.376	4514.249	3.873	 ma aiutano a capire {P} il il perché
1088	TO077	4514.812	4519.553	4.741	 aiuta a capire perché fior fior di antifascisti
1089	TO077	4520.207	4522.637	2.430	 e::::h dissero
1090	TO077	4523.291	4528.702	5.411	 ma forse per il momento vediamo vediamo come funziona: ehm
1091	TO077	4529.571	4531.780	2.209	 stiamo a vedere
1092	TO077	4532.260	4534.760	2.500	 e per altro va detto
1093	TO077	4535.411	4539.785	4.374	 che e:::h {P} il fascismo
1094	TO077	4540.663	4545.321	4.658	 non perse molto tempo eh a: m::h
1095	TO077	4545.885	4549.252	3.367	 dare chiaramente il segnale che
1096	TO077	4549.615	4551.830	2.215	 quel governo comunque
1097	TO077	4552.317	4553.165	0.848	 e::h
1098	TO077	4553.558	4557.172	3.614	 andava quantomeno nella direzione di uno
1099	TO077	4557.230	4560.167	2.937	 stravolgimento del sistema liberale
1100	TO077	4560.573	4561.826	1.253	 in genere
1101	TO077	4562.205	4566.312	4.107	 e:::h vengono indicati due provvedimenti
1102	TO077	4566.390	4568.485	2.095	 primissimi provvedimenti
1103	TO077	4569.142	4572.528	3.386	 che erano abbastanza inequivoci
1104	TO077	4572.683	4576.949	4.266	 nel dicembre del ventidue quindi {P} quasi subito
1105	TO077	4577.395	4582.345	4.950	 venne istituito un organismo che non esisteva prima
1106	TO077	4582.902	4585.586	2.684	 il gran consiglio del fascismo
1107	TO077	4586.371	4589.485	3.114	 organismo formalmente di partito
1108	TO077	4590.370	4595.035	4.665	 che aveva il compito di indicare le linee generali della politica
1109	TO077	4595.129	4598.996	3.867	 fascista e di servire da raccordo
1110	TO077	4599.201	4602.177	2.976	 tra il partito e il governo
1111	TO077	4602.701	4603.986	1.285	 e::h
1112	TO077	4604.502	4611.038	6.536	 era ovviamente una cosa che non esisteva nello statuto, non esisteva nella prassi, era
1113	TO077	4611.341	4614.220	2.879	 quello sì un elemento di discontinuità
1114	TO077	4614.580	4618.460	3.880	 piuttosto forte dal punto di vista costituzionale
1115	TO077	4618.712	4621.300	2.588	 nel gennaio del ventitré
1116	TO077	4621.639	4626.664	5.025	 e::h il secondo provvedimento che dà il segno di quel passaggio
1117	TO077	4627.080	4629.263	2.183	 e::h fu
1118	TO077	4629.893	4634.507	4.614	 il provvedimento con il quale le squadre fasciste
1119	TO077	4634.780	4639.723	4.943	 vennero inquadrate formalmente in un organismo
1120	TO077	4640.362	4646.545	6.183	 e::h chiamato milizia volontaria per la sicurezza nazionale
1121	TO077	4647.054	4651.118	4.064	 che era di fatto un corpo armato di partito
1122	TO077	4653.661	4654.705	1.044	 che però
1123	TO077	4655.300	4661.190	5.890	 e::h entrava a far parte dell' ordinamento dello stato
1124	TO077	4661.244	4667.485	6.241	 in una maniera molto molto ambigua perché era apertamente un organo militare
1125	TO077	4667.910	4668.726	0.816	 però
1126	TO077	4669.205	4673.636	4.431	 a differenza {P} di tutti i corpi dell' esercito
1127	TO077	4674.046	4678.552	4.506	 la milizia giurava fedeltà al duce
1128	TO077	4678.751	4683.586	4.835	 già mussolini nel corso del: cosiddetta rivoluzione fascista
1129	TO077	4684.338	4688.901	4.563	 aveva e::h era indicato in genere come duce
1130	TO077	4689.877	4696.150	6.273	 ecco la milizia votava fedeltà prima al duce {P} e poi al sovrano
1131	TO077	4696.599	4697.846	1.247	 là dove
1132	TO077	4698.519	4701.057	2.538	 tutti i corpi dell' esercito
1133	TO077	4702.116	4704.983	2.867	 giuravano fedeltà al sovrano
1134	TO077	4705.230	4707.401	2.171	 e tenete presente che questa
1135	TO077	4707.468	4713.530	6.062	 contraddizione, dialettica, chiamiamola come vogliamo rimmarrà durante la storia di tutto il fascismo.
1136	TO077	4714.821	4718.612	3.791	 e::h ci tornerò poi già nella lezione di domani
1137	TO077	4719.007	4722.071	3.064	 e::h nel corso di tutto il fascismo
1138	TO077	4722.405	4726.297	3.892	 l' esercito dal punto di vista formale
1139	TO077	4726.695	4732.353	5.658	 è sempre rimasto organo dello stato che prestava giuramento
1140	TO077	4732.659	4735.702	3.043	 al sovrano e poi al capo del gover~
1141	TO077	4735.839	4738.117	2.278	 la miliazia no, la milizia
1142	TO077	4738.564	4742.260	3.696	 era un corpo di partito inquadrato
1143	TO077	4743.411	4748.981	5.570	 e tra l' altro: mal sopportato dall' esercito: regolare
1144	TO077	4749.019	4750.502	1.483	 diciamo vabbè era
1145	TO077	4751.004	4752.820	1.816	 un branco di teste matte
1146	TO077	4753.146	4757.886	4.740	 eh increbili per cui difficile potessero piacere molto
1147	TO077	4758.068	4760.150	2.082	 ai generali dell' esercito
1148	TO077	4760.517	4764.739	4.222	 anche perché da loro eh statuto
1149	TO077	4765.009	4768.607	3.598	 e::h indicavano como proprio obietti~
1150	TO077	4768.646	4772.520	3.874	 cioè indicava la milizia come proprio obiettivo
1151	TO077	4772.675	4774.846	2.171	 quello di virgolette
1152	TO077	4775.166	4780.197	5.031	 proteggere gli inesorabili sviluppi della rivoluzione fascista
1153	TO077	4781.001	4784.159	3.158	 per cui quello anche è un un atto
1154	TO077	4784.351	4787.281	2.930	 politico non di poco xx
1155	TO077	4787.470	4789.917	2.447	 m:h non di poco conto.
1156	TO077	4790.938	4793.679	2.741	 ecco e::h
1157	TO077	4795.266	4797.070	1.804	 tutto questo
1158	TO077	4797.493	4801.816	4.323	 naturalmente non fece cessare
1159	TO077	4802.358	4803.422	1.064	 e::h
1160	TO077	4803.549	4808.068	4.519	 questo è un classico del fascismo u:na disinvolta
1161	TO077	4808.435	4814.220	5.785	 pratica della violenza illegale contro gli oppositori
1162	TO077	4814.803	4819.310	4.507	 ai quali eh alle quali ora però si: poteva
1163	TO077	4819.511	4824.461	4.950	 accompagnare una repressione chiamiamola {P} legale
1164	TO077	4825.012	4828.645	3.633	 condotta attraverso il ministero degli interni,
1165	TO077	4829.836	4833.848	4.012	 con la compiacenza di una parte della magistratura,
1166	TO077	4834.261	4836.311	2.050	 c' era la possibilità
1167	TO077	4836.736	4841.432	4.696	 ad esempio di sciogliere amministrazioni locali
1168	TO077	4841.702	4845.550	3.848	 facendo leva su contrasti interni
1169	TO077	4846.291	4850.766	4.475	 e le prime vittime di questo clima
1170	TO077	4851.001	4853.070	2.069	 furono i comunisti
1171	TO077	4853.431	4859.279	5.848	 i quali per altro erano per l' abbattimento violento dello stato xx
1172	TO077	4859.741	4861.475	1.734	 già nel ventitre
1173	TO077	4861.721	4865.430	3.709	 di fatto il partito comunista d' italia
1174	TO077	4865.734	4872.006	6.272	 e::h fu costretto a lavorare in una sorta di semiclandestinità
1175	TO077	4873.323	4878.955	5.632	 tra l' altro è però in tutti i casi è curioso qui mi avvio a
1176	TO077	4878.983	4883.635	4.652	 concludere la lezione di oggi chiedendo scusa se oggi sono stato veramente
1177	TO077	4883.677	4886.146	2.469	 più prolisso del sol~ però
1178	TO077	4886.569	4891.601	5.032	 quando si parla dell' italia, del fascismo, eccetera, mi sembra anche giusto
1179	TO077	4891.661	4897.202	5.541	 dedicargli una lezione, una lezione e mezzo o due insomma per l' importanza che ha
1180	TO077	4898.062	4900.505	2.443	 eh indicando però quelli che
1181	TO077	4901.077	4903.457	2.380	 cerco di indicare quelli che
1182	TO077	4903.710	4906.090	2.380	 eh sono i: punti
1183	TO077	4906.493	4909.829	3.336	 e::h storiograficamente più
1184	TO077	4911.636	4915.984	4.348	 controversi, più difficili da interpretare
1185	TO077	4916.549	4918.714	2.165	 perché e::h
1186	TO077	4918.763	4923.048	4.285	 torniamo sempre a quello che e::h avevo detto prima
1187	TO077	4923.077	4925.938	2.861	 questa ambiguità di fondo tra
1188	TO077	4926.177	4930.082	3.905	 una operazione politica e istituzionale
1189	TO077	4931.425	4936.412	4.987	 che aveva avuto e::h l' assenso del re e il voto di fiducia
1190	TO077	4936.662	4941.447	4.785	 della camera e per contro tutti quei caratteri palesemente
1191	TO077	4941.975	4946.842	4.867	 di illegalità o che comunque alludevano chiaramente
1192	TO077	4947.030	4952.228	5.198	 all' idea di uno stravolgimento {P} dello stato liberale.
1193	TO077	4953.399	4959.469	6.070	 il fascismo italiano qui cerco un po' di concentrare un po' di più i giudizi
1194	TO077	4959.509	4964.964	5.455	 in realtà il fascismo italiano ci mise un certo numero di anni
1195	TO077	4965.516	4966.156	0.640	 a:
1196	TO077	4967.330	4970.900	3.570	 realizzare {P} sino in fondo
1197	TO077	4971.029	4975.251	4.222	 quel eh {P} piano che pure
1198	TO077	4975.557	4982.006	6.449	 e::h aveva ancorché confusamente in testa piano di stravolgimento dello stato liberale
1199	TO077	4982.961	4984.011	1.050	 e::h
1200	TO077	4985.559	4989.135	3.576	 in genere si indica come
1201	TO077	4989.740	4991.803	2.063	 eh momento di
1202	TO077	4992.121	4995.362	3.241	 passaggio anche dal punto di vista
1203	TO077	4995.483	5001.958	6.475	 formale nella storia d' italia alla dittatura fascista vera e propria
1204	TO077	5002.665	5006.393	3.728	 il biennio millenovecentoventicinque ventisei
1205	TO077	5006.705	5010.345	3.640	 quando effettivamente furono
1206	TO077	5010.944	5012.811	1.867	 e:h introdotte
1207	TO077	5013.732	5017.441	3.709	 tutta una serie di e:h leggi
1208	TO077	5018.501	5025.171	6.670	 e:h ma questo lo vedremo nel dettaglio domani che anche dal punto di vista {P} formale
1209	TO077	5025.509	5026.496	0.987	 e::h
1210	TO077	5027.374	5032.500	5.126	 ormai come si di~ si usa un termine gior~ che non mi piace molto ormai si dice
1211	TO077	5032.548	5035.308	2.760	 bypassare no? {ride} comunque
1212	TO077	5035.440	5037.484	2.044	 bypassandolo
1213	TO077	5037.567	5040.864	3.297	 la lettera dello statuto albertino
1214	TO077	5041.202	5043.936	2.734	 si andava verso misure,
1215	TO077	5043.956	5049.671	5.715	 cioè quando u:n governo decreta la decadenza dalla funzione parlamentare
1216	TO077	5049.772	5053.151	3.379	 di tutti i parlamentare delle opposizioni
1217	TO077	5053.659	5059.336	5.677	 quando vengono sciolti i tutti partiti a eccezione del partito nazionale fascista
1218	TO077	5059.548	5064.732	5.184	 è difficile a quel punto non non parlare apertamente di una dittatura
1219	TO077	5065.215	5068.854	3.639	 ecco ma questi passaggi formali il fascismo
1220	TO077	5069.291	5073.455	4.164	 di:: fu in grado di realizzarvi e:h
1221	TO077	5073.795	5077.991	4.196	 qualche anno dopo millenovecentoventicinque ventisei
1222	TO077	5078.754	5084.804	6.050	 e: questo è importante tenerlo presente perché quando fra pochissimo
1223	TO077	5084.846	5087.289	2.443	 m:h dovrò affrontare
1224	TO077	5087.576	5091.943	4.367	 la crisi dello stato liberaldemocratico in germania
1225	TO077	5092.070	5093.963	1.893	 e vedere e:h
1226	TO077	5094.011	5099.683	5.672	 come il nazionalsocialismo è arrivato {P} al potere
1227	TO077	5100.006	5104.398	4.392	 e beh lì è importante tenere presente sarà importante
1228	TO077	5104.532	5108.924	4.392	 fare dei raffronti e guardare analogie e differenze
1229	TO077	5109.503	5111.928	2.425	 perché lo anticipo subito
1230	TO077	5112.059	5115.071	3.012	 ci sono delle analogie evidenti
1231	TO077	5115.426	5117.445	2.019	 anche in germania
1232	TO077	5118.016	5122.453	4.437	 il capo dello stato in quel caso il presidente della repubblica
1233	TO077	5122.810	5127.575	4.765	 ha dato eh il mandato di cancelliere a hitler
1234	TO077	5127.815	5131.910	4.095	 anche in quel caso reichstag aveva avuto un voto
1235	TO077	5132.455	5136.366	3.911	 però nel caso tedesco nel giro di pochi mesi
1236	TO077	5136.797	5140.405	3.608	 è lì lo stravolgimento della costituzione
1237	TO077	5140.753	5142.873	2.120	 è: è stato deciso
1238	TO077	5143.483	5148.647	5.164	 in italia tutto è stato invece più faticoso
1239	TO077	5148.824	5150.957	2.133	 da parte d~ del fascismo
1240	TO077	5151.168	5154.909	3.741	 e in genere {P} e::h
1241	TO077	5156.005	5158.492	2.487	 si indica come
1242	TO077	5158.719	5164.130	5.411	 motivo di fondo di questa differenza
1243	TO077	5164.594	5169.145	4.551	 e:::h il fatto che il fascismo italiano
1244	TO077	5169.626	5171.898	2.272	 dovesse fare i conti
1245	TO077	5172.229	5174.368	2.139	 volente o nolente
1246	TO077	5174.989	5179.343	4.354	 con e::h entità politiche
1247	TO077	5180.056	5183.847	3.791	 che non poteva e::h eliminare
1248	TO077	5186.124	5190.921	4.797	 e con le quali era giocoforza fare qualche compromesso.
1249	TO077	5191.145	5194.309	3.164	 principale era ovviamente la monarchia
1250	TO077	5195.004	5199.903	4.899	 e::h allora nell' italia fascista
1251	TO077	5200.158	5203.468	3.310	 era tutto una retorica sul duce,
1252	TO077	5203.511	5208.599	5.088	 il capo dello sta~ il capo del governo, eccetera, eccetera, eccetera, eccetera.
1253	TO077	5208.890	5211.245	2.355	 rimane pur sempre vero
1254	TO077	5211.514	5216.380	4.866	 che il capo dello stato {P} eh era il re
1255	TO077	5216.564	5221.653	5.089	 perché le leggi dello stato senza la firma del re non erano leggi
1256	TO077	5222.128	5224.451	2.323	 quello era un u:n
1257	TO077	5224.525	5228.778	4.253	 e perché il re torno al discorso fatto poco prima
1258	TO077	5228.879	5231.449	2.570	 era il garante della lealtà
1259	TO077	5231.857	5236.281	4.424	 verso il regime {P} dei vertici dell' esercito
1260	TO077	5237.123	5240.674	3.551	 che non erano {P} tutti così
1261	TO077	5240.936	5244.094	3.158	 e::h simpatetici col fascismo.
1262	TO077	5244.190	5247.501	3.311	 questo va detto uno lo capisce anche
1263	TO077	5247.986	5249.538	1.552	 cioè mussolini::
1264	TO077	5249.566	5255.813	6.247	 era non era mai andato oltre il grado di che cosa era stato non me lo ricordo più nell' esercito
1265	TO077	5256.059	5261.559	5.500	 le squadre fasciste erano piene di di scalmanati figurarsi quei
1266	TO077	5262.630	5265.047	2.417	 paludati e::h
1267	TO077	5265.433	5268.816	3.383	 generali dell' ese~ badate che non è un caso eh
1268	TO077	5268.846	5275.272	6.426	 per~ cioè queste cose contano nell' aspe~ e come se contano perché poi
1269	TO077	5275.403	5279.403	4.000	 passano anni:, ci puo' essere tutto quello che volete
1270	TO077	5279.920	5281.926	2.006	 però andiamo a vedere poi
1271	TO077	5281.953	5287.048	5.095	 lo vedremo eh ma cosa succede nel millenovecentoquarantatre quando (tutt~)
1272	TO077	5287.229	5291.995	4.766	 chi sono quelli che poi fanno lo sgambetto a mussolini e il fascismo
1273	TO077	5292.043	5296.157	4.114	 il re e il generale badoglio {P} caro re cioè
1274	TO077	5296.439	5298.677	2.238	 c' è una logica eh in queste co~
1275	TO077	5298.731	5305.196	6.465	 per carità il che non toglie che badoglio fosse stato anche fascistissimo intendiamoci
1276	TO077	5305.847	5307.309	1.462	 m:::h
1277	TO077	5307.392	5312.518	5.126	 lungi dal da me il voler dipingere eh di un generale badoglio
1278	TO077	5312.603	5313.666	1.063	 e::h
1279	TO077	5313.953	5318.744	4.791	 antifascista che è u::na bufala che non esiste da nessuna parte
1280	TO077	5319.356	5321.837	2.481	 però le cose contano
1281	TO077	5322.232	5328.757	6.525	 e: eh la monarchia e::h alla fine diventa quello che
1282	TO077	5329.070	5332.412	3.342	 e:::h perché il capo dello stato è lui
1283	TO077	5332.556	5336.321	3.765	 e badate che per tutto il periodo fascista
1284	TO077	5336.573	5340.984	4.411	 formalmente il re in qualunque momento
1285	TO077	5341.311	5344.197	2.886	 avrebbe avuto il potere
1286	TO077	5344.680	5350.025	5.345	 di chiamare mussolini e di dirgli eh ti destituisco
1287	TO077	5350.539	5357.001	6.462	 poi queste sono operazioni di di di di di fantastoria, di fantapolitica
1288	TO077	5357.396	5361.402	4.006	 perché non c' ha mai pensato il re di fare una cosa del genere
1289	TO077	5361.672	5363.672	2.000	 però sulla carta poteva farlo
1290	TO077	5363.754	5369.900	6.146	 questa realtà in germania, il ruolo della monarchia
1291	TO077	5370.222	5371.267	1.045	 non c' è
1292	TO077	5372.181	5376.067	3.886	 e: però badate anche in germania
1293	TO077	5376.392	5381.076	4.684	 il di~ il rapporto del nazionalsocialismo con l' esercito è stato
1294	TO077	5381.113	5386.360	5.247	 un rapporto molto complicato perché anche in germania negli ultimi anni di guerra
1295	TO077	5386.797	5390.778	3.981	 chi è che cerca di far fuori fisicamente hitler
1296	TO077	5391.325	5395.584	4.259	 sono alti ufficiali dell' esercito, prussiani
1297	TO077	5395.939	5401.293	5.354	 di quelli un vecchio nucleo centrale del dell' esercito tedesco
1298	TO077	5401.628	5407.311	5.683	 pensare cosa che giudizio potessero avere i generali prussiani
1299	TO077	5407.498	5413.650	6.152	 e::h di quel caporale eh di origine austriaca che era hitler m:h
1300	TO077	5413.845	5415.586	1.741	 non oso pensarlo.
1301	TO077	5415.718	5418.142	2.424	 e::h però ecco
1302	TO077	5418.866	5423.240	4.374	 lancio, volevo chiudere la lezione di oggi su queste
1303	TO077	5423.386	5426.051	2.665	 e:h su co~ con l' invito a ragionare
1304	TO077	5426.106	5430.745	4.639	 poi in termini di analogie e differenze con l' altro grande
1305	TO077	5431.141	5436.862	5.721	 sistema {P} fascista delle dell' europa del dopoguerra
1306	TO077	5437.274	5441.812	4.538	 l' italia è un caso in cui ci vogliono alcuni anni
1307	TO077	5442.202	5448.367	6.165	 e: e::h quindi si tratta di {P} tenere presente
1308	TO077	5449.647	5452.489	2.842	 quali sono i passaggi
1309	TO077	5452.685	5458.622	5.937	 che il fascismo italiano diventato guida del governo
1310	TO077	5458.972	5460.263	1.291	 e::h
1311	TO077	5461.455	5467.961	6.506	 penso' di fare, lì è tutto molto contraddittorio eh intendiamoci bene
1312	TO077	5468.375	5470.850	2.475	 perché {P} il
1313	TO077	5472.139	5476.677	4.538	 passo fondamentale che quel governo tentò di fare
1314	TO077	5477.306	5482.521	5.215	 e beh in qualche modo stava ancora dentro la logica parlamentare
1315	TO077	5482.584	5488.082	5.498	 era il problema di avere una solida maggioranza in parlamento da solo
1316	TO077	5488.689	5489.499	0.810	 perché
1317	TO077	5490.379	5496.329	5.950	 non erano mica scemi i fascisti lo sapevano benissimo di essere di mussolini meno che:
1318	TO077	5496.385	5500.892	4.507	 ma qualcun' altro forse scemo lo era ma mussolini credo proprio di no
1319	TO077	5501.119	5502.112	0.993	 cioè
1320	TO077	5502.400	5504.204	1.804	 la consapevolezza
1321	TO077	5504.315	5511.454	7.139	 di essere riusciti a compiere quel dal loro punto di vista capolavoro tra virgolette
1322	TO077	5511.811	5513.627	1.816	 era molto forte
1323	TO077	5513.892	5519.310	5.418	 questi ave~ continuavano ad avere trentacinque deputati
1324	TO077	5519.798	5522.703	2.905	 è vero che nel millenovecentoventitré
1325	TO077	5522.889	5526.585	3.696	 fecero la fusione col gruppo nazionalista
1326	TO077	5527.621	5533.165	5.544	 fondando quindi quello è: importante del millenovecentoventitré
1327	TO077	5533.266	5537.741	4.475	 è in genere viene chiamata la trasformazione del movimento
1328	TO077	5537.834	5539.955	2.121	 fascista in partito
1329	TO077	5540.197	5542.165	1.968	 che è un piccolo errore
1330	TO077	5542.517	5546.871	4.354	 o è un modo di vedere la cosa molto riduttiva
1331	TO077	5547.199	5549.850	2.651	 perché in realtà fu la fusione
1332	TO077	5550.113	5555.264	5.151	 tra il movimento fascista che non aveva mai voluto adottare
1333	TO077	5555.307	5559.300	3.993	 il termine partito perché sapeva di vecchia politica
1334	TO077	5559.570	5561.305	1.735	 e loro gli faceva schifo
1335	TO077	5561.639	5565.196	3.557	 la fusione con l' associazione nazionalista.
1336	TO077	5565.919	5570.571	4.652	 quindi {P} è la fusione di due forze politiche
1337	TO077	5571.582	5577.746	6.164	 che: nel percorso del fascismo è stato un fatto molto importante
1338	TO077	5578.193	5582.743	4.550	 perché ha significato eh fondersi
