tu_id	speaker	start	end	duration	include	W:normalized_spaces	W:numbers	W:accents	W:non_jefferson	W:pauses_trim	W:prosodic_trim	W:moved_boundaries	E:volume	E:pace	E:guess	E:overlap	E:overlap_mismatch	E:overlap_duration	T:shortpauses	T:metalinguistic	T:errors	T:linguistic	annotation	correct	text
284	BO140	1104.146	1117.733	13.587	True	0	0	0	1	0	0	0	False	False	False	False	False	_	0	1	0	43	vabbè al di là non offre niente ((*nomepaese)) non mh cioè comunque continuano a lavorarci le persone che ci hanno lavorato da una vita ma per i giovani:: non c' è possibilità lavorativa a meno che: non ti accontenti comunque di lavorare al ba:r,	vabbè al di là non offre niente {nomepaese} non mh cioè comunque continuano a lavorarci le persone che ci hanno lavorato da una vita ma per i giovani:: non c' è possibilità lavorativa a meno che: non ti accontenti comunque di lavorare al ba:r,	vabbè al di là non offre niente {nomepaese} non mh cioè comunque continuano a lavorarci le persone che ci hanno lavorato da una vita ma per i giovani non c' è possibilità lavorativa a meno che non ti accontenti comunque di lavorare al bar
285	BO140	1118.31	1124.65	6.34	True	0	0	0	0	0	0	0	False	False	False	False	False	_	0	0	0	15	o:: in un ristorante insomma o se:: riesci a reinventarti: e: costruisci una tua attività	o:: in un ristorante insomma o se:: riesci a reinventarti: e: costruisci una tua attività	o in un ristorante insomma o se riesci a reinventarti e costruisci una tua attività
286	BO140	1125.135	1131.76	6.625	True	0	0	0	0	0	0	0	False	False	False	False	False	_	0	0	0	20	però è:: è difficile insomma io da: ingegnere:: a meno che non vado a lavorare in uno studio di ingegneria:,	però è:: è difficile insomma io da: ingegnere:: a meno che non vado a lavorare in uno studio di ingegneria:,	però è è difficile insomma io da ingegnere a meno che non vado a lavorare in uno studio di ingegneria
287	BO140	1132.082	1136.6	4.518	True	0	0	0	1	0	0	0	False	False	False	False	False	_	0	1	0	15	e comunque rinchiudere tutta la mia vita a ((*nomepaese)) e non lo vorrò mai fare perché:	e comunque rinchiudere tutta la mia vita a {nomepaese} e non lo vorrò mai fare perché:	e comunque rinchiudere tutta la mia vita a {nomepaese} e non lo vorrò mai fare perché
288	BO140	1137.041	1145.65	8.609	True	0	0	0	0	0	0	0	False	False	False	False	False	_	0	0	0	21	comunque:: mh ti offre poco a livello sia:: cioè offre anche poco divertimento a livello giovanile ma anche per delle famiglie	comunque:: mh ti offre poco a livello sia:: cioè offre anche poco divertimento a livello giovanile ma anche per delle famiglie	comunque mh ti offre poco a livello sia cioè offre anche poco divertimento a livello giovanile ma anche per delle famiglie
289	BO140	1146.255	1152.7	6.445	True	0	0	0	1	0	0	0	False	False	False	False	False	_	0	1	0	17	cioè io non ho ricordi di quando son piccola::: che uscivo con i miei in centro a ((*nomepaese))	cioè io non ho ricordi di quando son piccola::: che uscivo con i miei in centro a {nomepaese}	cioè io non ho ricordi di quando son piccola che uscivo con i miei in centro a {nomepaese}
290	BO118	1153.116	1153.49	0.374	True	0	0	0	0	0	0	0	False	False	False	False	False	_	0	0	0	1	no[:?]	no[:?]	no
291	BO140	1153.345	1156.7	3.355	True	0	0	0	0	0	0	0	False	False	False	False	False	_	0	0	0	6	[pe]rché non: ma pochissimi perché [non:]	[pe]rché non: ma pochissimi perché [non:]	perché non ma pochissimi perché non
292	BO118	1156.447	1158.01	1.563	True	1	0	0	1	0	0	0	False	False	False	False	False	_	0	1	1	6	[ma] in realtà anch' io a ((*nomepaese)).	[ma] in realtà anch' io a {nomepaese} .	ma in realtà anch' io a {nomepaese} .
293	BO118	1158.17	1161.713	3.543	True	0	0	0	2	0	0	0	False	False	False	False	False	_	0	2	0	12	cioè non ho ricordi che uscissi a ((*nomepaese)) o a ((*nomepaese)) con i miei	cioè non ho ricordi che uscissi a {nomepaese} o a {nomepaese} con i miei	cioè non ho ricordi che uscissi a {nomepaese} o a {nomepaese} con i miei
294	BO118	1162.596	1167.01	4.414	True	0	0	0	0	0	0	0	False	False	False	False	False	_	0	0	0	10	forse xx più nel paesi:no nostro::, [ma sem]pre solite co::se:,	forse xx più nel paesi:no nostro::, [ma sem]pre solite co::se:,	forse xx più nel paesino nostro ma sempre solite cose
295	BO140	1165.3	1166.24	0.94	True	0	0	0	0	0	0	0	False	False	False	False	False	_	0	0	0	3	[sì sì sì]	[sì sì sì]	sì sì sì
296	BO140	1167.712	1186.39	18.678	True	0	0	0	0	0	0	0	False	False	False	False	False	_	0	0	0	42	sì però::: cioè magari ci sono pochi eventi: e iniziative::: offerte in una città più piccola che poi non è sempre vero perché ci son tante periferie tanti piccoli borghetti che organizzano tanti eventi:: e: la qualità della vita è: è buona	sì però::: cioè magari ci sono pochi eventi: e iniziative::: offerte in una città più piccola che poi non è sempre vero perché ci son tante periferie tanti piccoli borghetti che organizzano tanti eventi:: e: la qualità della vita è: è buona	sì però cioè magari ci sono pochi eventi e iniziative offerte in una città più piccola che poi non è sempre vero perché ci son tante periferie tanti piccoli borghetti che organizzano tanti eventi e la qualità della vita è è buona
297	BO140	1186.912	1191.7	4.788	True	0	0	0	1	0	0	0	False	False	False	False	False	_	0	1	0	13	però ((*nomepaese)) secondo me per quanto sia anche una città universitaria:: non offre nulla.	però {nomepaese} secondo me per quanto sia anche una città universitaria:: non offre nulla.	però {nomepaese} secondo me per quanto sia anche una città universitaria non offre nulla
298	BO118	1191.7	1195.2	3.5	True	0	0	0	0	0	0	0	False	False	False	False	False	_	0	0	0	12	eh ma infatti è stra:no cioè comunque è un polo universitario grosso	eh ma infatti è stra:no cioè comunque è un polo universitario grosso	eh ma infatti è strano cioè comunque è un polo universitario grosso
299	BO140	1195.34	1195.75	0.41	True	0	0	0	0	0	0	0	False	False	False	False	False	_	0	0	0	1	sì.	sì.	sì
300	BO118	1195.755	1198.89	3.135	True	0	0	0	0	0	0	0	False	False	False	False	False	_	0	0	0	9	cioè ci viene gente dal su:d veramente: [xx xxx]	cioè ci viene gente dal su:d veramente: [xx xxx]	cioè ci viene gente dal sud veramente xx xxx
301	BO140	1197.727	1200.96	3.233	True	0	0	0	0	0	0	0	False	False	False	False	False	_	0	0	0	7	[eh ma è che l' ammini]strazione:: mh:	[eh ma è che l' ammini]strazione:: mh:	eh ma è che l' amministrazione mh
302	BO140	1201.782	1207.47	5.688	True	0	0	0	0	0	0	0	False	False	False	False	False	_	0	0	0	22	non è interessata probabilmente cioè nel senso negli ultimi due anni mi sto accorgendo che stan cercando di far dei passi avanti	non è interessata probabilmente cioè nel senso negli ultimi due anni mi sto accorgendo che stan cercando di far dei passi avanti	non è interessata probabilmente cioè nel senso negli ultimi due anni mi sto accorgendo che stan cercando di far dei passi avanti
303	BO140	1208.061	1216.62	8.559	True	0	0	0	0	0	0	0	False	False	False	False	False	_	0	0	0	18	però:: da quando:: ero: adolesce:nte dai diciamo dai:: boh quattordici anni ho cominciato a uscire: fino: ad adesso,	però:: da quando:: ero: adolesce:nte dai diciamo dai:: boh quattordici anni ho cominciato a uscire: fino: ad adesso,	però da quando ero adolescente dai diciamo dai boh quattordici anni ho cominciato a uscire fino ad adesso
304	BO140	1216.95	1219.52	2.57	True	0	0	0	0	0	0	0	False	False	False	False	False	_	0	0	0	6	che ne ho venticinque comunque non:,	che ne ho venticinque comunque non:,	che ne ho venticinque comunque non
305	BO140	1220.155	1225.41	5.255	True	0	0	0	0	0	0	0	False	False	False	False	False	_	0	0	0	13	cioè non trovo cioè non ho mai trovato dei:: dei grandi eventi: o:,	cioè non trovo cioè non ho mai trovato dei:: dei grandi eventi: o:,	cioè non trovo cioè non ho mai trovato dei dei grandi eventi o
306	BO140	1226.282	1233.32	7.038	True	0	0	0	0	0	0	0	False	False	False	False	False	_	0	0	0	19	cioè possibilità di divertirmi: anzi quando avevo quattordici anni ce ne erano molti di più: organizzavano anche dei concer[ti::]	cioè possibilità di divertirmi: anzi quando avevo quattordici anni ce ne erano molti di più: organizzavano anche dei concer[ti::]	cioè possibilità di divertirmi anzi quando avevo quattordici anni ce ne erano molti di più organizzavano anche dei concerti
307	BO118	1232.73	1233.328	0.598	True	0	0	0	0	0	0	0	False	False	False	False	False	_	0	0	0	1	[sì?]	[sì?]	sì
308	BO140	1233.661	1240.22	6.559	True	0	0	0	0	0	0	0	False	False	False	False	False	_	0	0	0	21	sì [l' uni]versità organizzava dei concerti e lasciavano mo:lto più liberi gli universitari di esprimersi e anche a livello proprio organizzativo	sì [l' uni]versità organizzava dei concerti e lasciavano mo:lto più liberi gli universitari di esprimersi e anche a livello proprio organizzativo	sì l' università organizzava dei concerti e lasciavano molto più liberi gli universitari di esprimersi e anche a livello proprio organizzativo
309	BO118	1233.854	1234.504	0.65	True	0	0	0	0	0	0	0	False	False	False	False	False	_	0	0	0	1	[ah::]	[ah::]	ah
310	BO140	1240.605	1245.52	4.915	True	0	0	0	0	0	0	0	False	False	False	False	False	_	0	0	0	16	mentre adesso gli stanno tagliando le gambe ovu:nque: a chiu:nque e: non c' è più niente.	mentre adesso gli stanno tagliando le gambe ovu:nque: a chiu:nque e: non c' è più niente.	mentre adesso gli stanno tagliando le gambe ovunque a chiunque e non c' è più niente
311	BO140	1246.06	1246.87	0.81	True	0	0	0	0	0	0	0	False	False	False	False	False	_	0	0	0	2	quindi: [xx]	quindi: [xx]	quindi xx
312	BO118	1246.694	1249.39	2.696	True	0	0	0	0	0	0	0	False	False	False	False	False	_	0	0	0	13	[ma] in realtà anche a bologna stanno a fa' un po' sto lavoro.	[ma] in realtà anche a bologna stanno a fa' un po' sto lavoro.	ma in realtà anche a bologna stanno a fa' un po' sto lavoro
313	BO140	1249.615	1255.26	5.645	True	0	0	0	0	0	0	0	False	False	False	False	False	_	0	0	0	18	sì però bologna essendo più gra:nde secondo me:: c' è più via di uscita e ne risente meno.	sì però bologna essendo più gra:nde secondo me:: c' è più via di uscita e ne risente meno.	sì però bologna essendo più grande secondo me c' è più via di uscita e ne risente meno
314	BO140	1255.995	1266.78	10.785	True	0	0	0	1	0	0	0	False	False	False	False	False	_	0	1	0	31	mentre un paesin~ un: piccolo centro come ((*nomepaese)) dove c' è una piazza: e ci sono: boh dieci locali: se a tutti tagli le gambe: non c' è più: via d' uscita	mentre un paesin~ un: piccolo centro come {nomepaese} dove c' è una piazza: e ci sono: boh dieci locali: se a tutti tagli le gambe: non c' è più: via d' uscita	mentre un paesin~ un piccolo centro come {nomepaese} dove c' è una piazza e ci sono boh dieci locali se a tutti tagli le gambe non c' è più via d' uscita
315	BO140	1266.92	1268.36	1.44	True	0	0	0	0	0	0	0	False	False	False	False	False	_	0	0	0	6	cioè ti devi spostare per fo:rza.	cioè ti devi spostare per fo:rza.	cioè ti devi spostare per forza
316	BO140	1269.26	1279.52	10.26	True	0	0	0	0	0	0	0	False	False	False	False	False	_	0	0	0	33	e non è una città: vic~ che è vicino a tante possibilità: cioè la vi~ cioè la città più gran~ più grande xxx diciamo più vicina che è leggermente più grande è pe:saro.	e non è una città: vic~ che è vicino a tante possibilità: cioè la vi~ cioè la città più gran~ più grande xxx diciamo più vicina che è leggermente più grande è pe:saro.	e non è una città vic~ che è vicino a tante possibilità cioè la vi~ cioè la città più gran~ più grande xxx diciamo più vicina che è leggermente più grande è pesaro
317	BO118	1279.547	1280.027	0.48	True	0	0	0	0	0	0	0	False	False	False	False	False	_	0	0	0	1	mhmh	mhmh	mhmh
318	BO140	1280.09	1283.21	3.22	True	0	0	0	0	0	0	0	False	False	False	False	False	_	0	0	0	16	ma comunque si:a prendi la macchina per andare a pesaro ci metti tre quarti d' o:ra.	ma comunque si:a prendi la macchina per andare a pesaro ci metti tre quarti d' o:ra.	ma comunque sia prendi la macchina per andare a pesaro ci metti tre quarti d' ora
319	BO140	1283.845	1288.74	4.895	True	0	0	0	0	0	0	0	False	False	False	False	False	_	0	0	0	17	e: cioè ti passa un po' la voglia diciamo a fare avanti e indietro comunque: per [questo]	e: cioè ti passa un po' la voglia diciamo a fare avanti e indietro comunque: per [questo]	e cioè ti passa un po' la voglia diciamo a fare avanti e indietro comunque per questo
320	BO118	1288.382	1290.37	1.988	True	0	0	0	0	0	0	0	False	False	False	False	False	_	0	0	0	5	[pen]savo fosse:: fosse più vicina.	[pen]savo fosse:: fosse più vicina.	pensavo fosse fosse più vicina
321	BO140	1291.11	1296.94	5.83	True	0	0	0	0	0	0	0	False	False	False	False	False	_	0	0	0	14	no in realtà son trentacinque chilometri ma: la strada: è::=mh cioè è vecchia	no in realtà son trentacinque chilometri ma: la strada: è::=mh cioè è vecchia	no in realtà son trentacinque chilometri ma la strada è mh cioè è vecchia
322	BO140	1297.3	1302.94	5.64	True	0	0	0	1	0	0	0	False	False	False	False	False	_	0	1	0	16	e quindi ci metti ta:nto tempo poi è l' unica strada che collega: pesaro a ((*nomepaese)) e:::	e quindi ci metti ta:nto tempo poi è l' unica strada che collega: pesaro a {nomepaese} e:::	e quindi ci metti tanto tempo poi è l' unica strada che collega pesaro a {nomepaese} e
323	BO140	1303.33	1305.95	2.62	True	0	0	0	0	0	0	0	False	False	False	False	False	_	0	0	0	7	non c' hai: altro modo: per andare	non c' hai: altro modo: per andare	non c' hai altro modo per andare
324	BO140	1306.297	1309.76	3.463	True	0	0	0	0	0	0	0	False	False	False	False	False	_	0	0	0	12	e devi fare unicamente quella quindi c' è anche mh abbastanza traffico	e devi fare unicamente quella quindi c' è anche mh abbastanza traffico	e devi fare unicamente quella quindi c' è anche mh abbastanza traffico
325	BO118	1309.787	1312.18	2.393	True	0	0	0	0	0	0	0	False	False	False	False	False	_	0	0	0	9	e pesaro è più viva a livello: [di] eventi?	e pesaro è più viva a livello: [di] eventi?	e pesaro è più viva a livello di eventi
326	BO140	1311.413	1311.813	0.4	True	0	0	0	0	0	0	0	False	False	False	False	False	_	0	0	0	1	[sì]	[sì]	sì
327	BO140	1312.188	1313.08	0.892	True	0	0	0	0	0	0	0	False	False	False	False	False	_	0	0	0	4	sì=sì pesaro sì.	sì=sì pesaro sì.	sì sì pesaro sì
328	BO140	1313.36	1316.35	2.99	True	0	0	0	0	0	0	0	False	False	False	False	False	_	0	0	0	9	assolutamente cioè me ne sto accorgendo adesso con michele.	assolutamente cioè me ne sto accorgendo adesso con michele.	assolutamente cioè me ne sto accorgendo adesso con michele
329	BO140	1317.19	1321.64	4.45	True	0	0	0	0	0	0	0	False	False	False	False	False	_	0	0	0	10	che: cioè comunque: si:: cioè si vive be:ne a pesaro	che: cioè comunque: si:: cioè si vive be:ne a pesaro	che cioè comunque si cioè si vive bene a pesaro
330	BO140	1321.935	1326.145	4.21	True	0	0	0	0	0	0	0	False	False	False	False	False	_	0	0	0	13	perché: sicuramente è anche dato dal fatto che ha un' amministrazione più ricca.	perché: sicuramente è anche dato dal fatto che ha un' amministrazione più ricca.	perché sicuramente è anche dato dal fatto che ha un' amministrazione più ricca
331	BO140	1326.6	1328.35	1.75	True	0	0	0	0	0	0	0	False	False	False	False	False	_	0	0	0	6	cioè è un comune ricco: pesaro.	cioè è un comune ricco: pesaro.	cioè è un comune ricco pesaro
332	BO118	1328.36	1328.92	0.56	True	0	0	0	0	0	0	0	False	False	False	False	False	_	0	0	0	2	mh mh	mh mh	mh mh
333	BO140	1328.927	1331.15	2.223	True	0	0	0	0	0	0	0	False	False	False	False	False	_	0	0	0	2	quindi: mh:	quindi: mh:	quindi mh
334	BO140	1331.477	1341.53	10.053	True	0	0	0	0	0	0	0	False	False	False	False	False	_	0	0	0	24	cioè investono tanto nel:: mh in eventi: cittadini:: anche per dire l' accensione delle luci natalizie: c' erano boh migliaia di persone in piazza.	cioè investono tanto nel:: mh in eventi: cittadini:: anche per dire l' accensione delle luci natalizie: c' erano boh migliaia di persone in piazza.	cioè investono tanto nel mh in eventi cittadini anche per dire l' accensione delle luci natalizie c' erano boh migliaia di persone in piazza
335	BO140	1342.02	1344.05	2.03	True	0	0	0	0	0	0	0	False	False	False	False	False	_	0	0	0	6	e non si passa:va neanche [quindi]	e non si passa:va neanche [quindi]	e non si passava neanche quindi
336	BO118	1343.728	1345.948	2.22	True	0	0	0	0	0	0	0	False	False	False	False	False	_	0	0	0	7	[e:: a] pesaro ci stanno delle università:?	[e:: a] pesaro ci stanno delle università:?	e a pesaro ci stanno delle università
337	BO140	1346.355	1354.18	7.825	True	0	0	0	0	0	0	0	False	False	False	False	False	_	0	0	0	25	a pesaro ci sono un paio di università due o tre facoltà insomma ma sono dei corsi di laurea: di::: di ancona e di urbino.	a pesaro ci sono un paio di università due o tre facoltà insomma ma sono dei corsi di laurea: di::: di ancona e di urbino.	a pesaro ci sono un paio di università due o tre facoltà insomma ma sono dei corsi di laurea di di ancona e di urbino
338	BO118	1354.213	1354.703	0.49	True	0	0	0	0	0	0	0	False	False	False	False	False	_	0	0	0	2	mh mh	mh mh	mh mh
339	BO140	1354.792	1357.64	2.948	True	0	0	0	0	0	0	0	False	False	False	False	False	_	0	0	0	9	cioè pesaro: come città non ha un' università propria.	cioè pesaro: come città non ha un' università propria.	cioè pesaro come città non ha un' università propria
340	BO118	1357.77	1358.43	0.66	True	0	0	0	0	0	0	0	False	False	False	False	True	_	0	0	0	1	o:ka[y]	o:ka[y]	okay
341	BO140	1358.437	1360.903	2.566	True	0	0	0	0	0	0	0	False	False	False	False	True	_	0	0	0	6	[a]ccoglie solo: nelle sedi: dei corsi	[a]ccoglie solo: nelle sedi: dei corsi	accoglie solo nelle sedi dei corsi
342	BO118	1360.907	1361.92	1.113	True	0	0	0	0	0	0	0	False	False	False	False	False	_	0	0	0	2	tipo: succursali	tipo: succursali	tipo succursali
343	BO140	1362.01	1362.837	0.827	True	0	0	0	0	0	0	0	False	False	False	False	False	_	0	0	0	3	sì=sì=sì	sì=sì=sì	sì sì sì
344	BO118	1362.852	1364.63	1.778	True	0	0	0	0	0	0	0	False	False	False	False	False	_	0	0	0	6	e tipo a pesaro c' abiteresti?	e tipo a pesaro c' abiteresti?	e tipo a pesaro c' abiteresti
345	BO140	1364.65	1365.14	0.49	True	0	0	0	0	0	0	0	False	False	False	False	False	_	0	0	0	1	sì.	sì.	sì
346	BO140	1365.41	1366.26	0.85	True	0	0	0	0	0	0	0	False	False	False	False	False	_	0	0	0	3	a pesaro sì.	a pesaro sì.	a pesaro sì
347	BO140	1366.667	1370.27	3.603	True	0	0	0	0	0	0	0	False	False	False	False	False	_	0	0	0	8	perché:: ho sempre pensato di riavvicinarmi a ca:sa,	perché:: ho sempre pensato di riavvicinarmi a ca:sa,	perché ho sempre pensato di riavvicinarmi a casa
348	BO140	1371.038	1374.52	3.482	True	0	0	0	0	0	0	0	False	False	False	False	False	_	0	0	0	10	e: quindi comunque: ritornare vicino ai mie:i, alla mia famiglia,	e: quindi comunque: ritornare vicino ai mie:i, alla mia famiglia,	e quindi comunque ritornare vicino ai miei alla mia famiglia
349	BO140	1375.273	1381.44	6.167	True	0	0	0	1	0	0	0	False	False	False	False	False	_	0	1	0	20	ma allo stesso tempo:: per il discorso che facevo prima non mi piacerebbe vivere a ((*nomepaese)) o in un piccolo paese	ma allo stesso tempo:: per il discorso che facevo prima non mi piacerebbe vivere a {nomepaese} o in un piccolo paese	ma allo stesso tempo per il discorso che facevo prima non mi piacerebbe vivere a {nomepaese} o in un piccolo paese
350	BO118	1381.47	1382.13	0.66	True	0	0	0	0	0	0	0	False	False	False	False	False	_	0	0	0	1	<okay>	<okay>	okay
351	BO140	1382.544	1393.53	10.986	True	0	0	0	0	0	0	0	False	False	False	False	False	_	0	0	0	36	e pesaro diciamo che è un po' la[:: la cioè la] sìùÁ il compromesso giusto: perché: ti offre tanto di più: e allo stesso tempo è comunque una piccola città: e: in cui vivi bene: e:	e pesaro diciamo che è un po' la[:: la cioè la] sìùÁ il compromesso giusto: perché: ti offre tanto di più: e allo stesso tempo è comunque una piccola città: e: in cui vivi bene: e:	e pesaro diciamo che è un po' la la cioè la sìùá il compromesso giusto perché ti offre tanto di più e allo stesso tempo è comunque una piccola città e in cui vivi bene e
352	BO118	1384.8	1385.95	1.15	True	0	0	0	0	0	0	0	False	False	False	False	False	_	0	0	0	2	[il compromesso.]	[il compromesso.]	il compromesso
353	BO140	1394.16	1396.82	2.66	True	0	0	0	0	0	0	0	False	False	False	False	False	_	0	0	0	8	mh le persone si conoscono generalmente anche se:,	mh le persone si conoscono generalmente anche se:,	mh le persone si conoscono generalmente anche se
354	BO140	1397.52	1399.72	2.2	True	0	0	0	0	0	0	0	False	False	False	False	False	_	0	0	0	8	boh. non so quanti abitanti ci si:ano però,	boh. non so quanti abitanti ci si:ano però,	boh non so quanti abitanti ci siano però
355	BO118	1400.44	1403.57	3.13	True	0	0	0	1	0	0	0	False	False	False	False	False	_	0	1	0	11	non lo so no~ non [pensavo] nemmeno fosse più grande di ((*nomepaese))	non lo so no~ non [pensavo] nemmeno fosse più grande di {nomepaese}	non lo so no~ non pensavo nemmeno fosse più grande di {nomepaese}
356	BO140	1401.315	1402.57	1.255	True	0	0	0	0	0	0	0	False	False	False	False	False	_	0	0	0	2	[centomi:la perlom~]	[centomi:la perlom~]	centomila perlom~
357	BO118	1403.91	1406.387	2.477	True	0	0	0	1	0	0	0	False	False	False	False	False	_	0	1	0	9	poi io [non ho] mai visto né pesaro né ((*nomepaese))	poi io [non ho] mai visto né pesaro né {nomepaese}	poi io non ho mai visto né pesaro né {nomepaese}
358	BO140	1404.2	1404.79	0.59	True	0	0	0	0	0	0	0	False	False	False	False	False	_	0	0	0	1	[si:]	[si:]	si
359	BO140	1406.61	1407.3	0.69	True	0	0	0	0	0	0	0	False	False	False	False	False	_	0	0	0	3	no a [livel~]	no a [livel~]	no a livel~
360	BO118	1406.75	1408.0	1.25	True	0	0	0	0	0	0	0	False	False	False	False	False	_	0	0	0	6	[quindi non c' ho] proprio idea.	[quindi non c' ho] proprio idea.	quindi non c' ho proprio idea
361	BO140	1408.3	1413.24	4.94	True	0	0	0	1	0	0	0	False	False	False	False	False	_	0	1	0	9	e:: che::: no beh ((*nomepaese)) in realtà conta: quindicimila abita:nti	e:: che::: no beh {nomepaese} in realtà conta: quindicimila abita:nti	e che no beh {nomepaese} in realtà conta quindicimila abitanti
362	BO118	1413.24	1413.82	0.58	True	0	0	0	0	0	0	0	False	False	False	False	False	_	0	0	0	2	°ah po[chi]°	°ah po[chi]°	ah pochi
363	BO140	1413.65	1416.58	2.93	True	0	0	0	0	0	0	0	False	False	False	False	False	_	0	0	0	9	[qui:]ndi sì ne fa trentamila con gli studenti universit[ari]	[qui:]ndi sì ne fa trentamila con gli studenti universit[ari]	quindi sì ne fa trentamila con gli studenti universitari
364	BO118	1416.46	1417.27	0.81	True	0	0	0	0	0	0	0	False	False	False	False	False	_	0	0	0	2	[eh] ecco	[eh] ecco	eh ecco
365	BO140	1417.28	1426.5	9.22	True	0	0	0	2	0	0	0	False	False	False	False	False	_	0	0	0	31	e:: quindi sembra:: sì: ah in realtà di @abitantipaese ce ne sono quindicimila:: e non ce ne son più perché scappan tutti da @nomepaese perché: non ti offre più niente invece:,	e:: quindi sembra:: sì: ah in realtà di abitantipaese ce ne sono quindicimila:: e non ce ne son più perché scappan tutti da nomepaese perché: non ti offre più niente invece:,	e quindi sembra sì ah in realtà di abitantipaese ce ne sono quindicimila e non ce ne son più perché scappan tutti da nomepaese perché non ti offre più niente invece
366	BO140	1427.03	1429.96	2.93	True	0	0	0	0	0	0	0	False	False	False	False	False	_	0	0	0	8	pe:saro xx la gente continua a: anzi to:rna	pe:saro xx la gente continua a: anzi to:rna	pesaro xx la gente continua a anzi torna
367	BO140	1430.43	1431.9	1.47	True	0	0	0	0	0	0	0	False	False	False	False	False	_	0	0	0	8	perché è una città in cui stai bene.	perché è una città in cui stai bene.	perché è una città in cui stai bene
368	BO140	1433.475	1435.04	1.565	True	0	0	0	0	0	0	0	False	False	False	False	False	_	0	0	0	1	e::::	e::::	e
369	BO140	1438.23	1439.77	1.54	True	0	0	0	0	0	0	0	False	False	False	False	False	_	0	0	0	6	e quindi sì: abiterei a pesaro.	e quindi sì: abiterei a pesaro.	e quindi sì abiterei a pesaro
370	BO140	1439.98	1441.27	1.29	True	0	0	0	0	0	0	0	False	False	False	False	False	_	0	0	0	4	m[i piace come città]	m[i piace come città]	mi piace come città
371	BO118	1440.04	1444.38	4.34	True	0	0	0	0	0	0	0	False	False	False	False	False	_	0	0	0	13	[io sto p~ sto] pensando all' equivale:nte de quello che potrebbe esse pesaro,	[io sto p~ sto] pensando all' equivale:nte de quello che potrebbe esse pesaro,	io sto p~ sto pensando all' equivalente de quello che potrebbe esse pesaro
372	BO118	1444.53	1448.78	4.25	True	0	0	0	1	0	0	0	False	False	False	False	False	_	0	1	0	12	tipo vicino ((*nomepaese)) non so se tipo anco:na potrebbe esse una cosa simile.	tipo vicino {nomepaese} non so se tipo anco:na potrebbe esse una cosa simile.	tipo vicino {nomepaese} non so se tipo ancona potrebbe esse una cosa simile
373	BO140	1449.915	1452.96	3.045	True	0	0	0	0	0	0	0	False	False	False	False	False	_	0	0	0	13	non lo so perché io ad ancona non ci son mai stata sinceramente	non lo so perché io ad ancona non ci son mai stata sinceramente	non lo so perché io ad ancona non ci son mai stata sinceramente
374	BO118	1452.96	1454.6	1.64	True	0	0	0	0	0	0	0	False	False	False	False	False	_	0	0	0	5	ancona è carina solo che,	ancona è carina solo che,	ancona è carina solo che
